CommentID,CommentText,Model_Classification,Annotation,NumberOfLikes,IsReply,Level,ParentCommentText,Timestamp
COMMENT_e5f6fc66,This is so shocking. We don't feel safe with them here. I feel invaded and fearful that our neighborhoods are being invaded.,PRCT,True,53,True,0,,2023-08
COMMENT_59c734e6,'invading criminals foreign nationals' is the only proper term!,PRCT,True,0,True,1,Glad to see Americans finally waking up against immigration.,2023-08
COMMENT_b9ff454b,@[USER]  that would be cruel to the criminal invaders...lmao,PRCT,True,0,True,2,SEND THEM ALL to White House and dems congressmen private houses IMMIDIATELY!!!!!,2023-08
COMMENT_3b9ee7ce,It is not that easy. Would you fill up a country with 5 million migrants from an alien culture willing to integrate?. Nobody asks the natives if they want to feel like foreigners in their own districts.,PRCT,True,0,True,1,if a group wants to come into your country they need to learn the launguage and culture and intergrate or be sent back simple. nothing wrong with people wanting to come in but they need to earn and prove worthy of trust.,2023-03
COMMENT_c734db5f,He's looking at the ones that's gonna replace you😅,PRCT,True,0,True,1,Is he looking for new Tesla employees 😂😅,2023-09
COMMENT_eda94e3d,@[USER] they are invaders by the democrats. Asylum seekers don’t act like thugs. The first thing you do is go to an embassy to get paperwork to come to the country legally. Like a traveler going to another country,PRCT,True,0,True,2,"People wanting a better life, the way the middle class is going soon will be banging on their doors.",2024-09
COMMENT_4ec4613e,That law was passed without the knowledge of millions of Americans and lied about its intended purposes. It was enforced to destroy the white American society the tiny hat people hate like every other white society,PRCT,True,0,True,1,"As a British person, I feel sorry for the people of the USA who thought voting for this would help them.",2023-09
COMMENT_08d9c242,@[USER]  the Kalergi plan!!!!,PRCT,True,0,True,3,@[USER] 🎯🎯🎯🎯🎯🎯🎯,2024-02
COMMENT_cb6a6485,Yeah really...but they are already organized by the democratic agenda team to take over the United States,PRCT,True,0,True,1,They need to organize like this to take their own country back,2023-05
COMMENT_3d1f0b92,Nope. Criminal Invaders,PRCT,True,0,True,1,They are Not migrants!,2024-02
COMMENT_4272ad0e,"Yes, it is truly an invasion. We don't know who the fu*k the gov't is letting into the U.S.",PRCT,True,0,True,1,God bless the people of Staten Island! You showed everyone else how to get this sickening invasion of our cities and town to END.,2023-09
COMMENT_480c89c2,Our country fucks their country up to encourage them to come here. They want the us to be no different than the shit holes from which they came. Then they can say look how bad it is. We have to keep you safe bg controlling all the resources. Look at france or sharia compliant england. They are now middle eastern/african,PRCT,True,0,True,1,I wish their countries could just get their acts together so these people wouldnt need to leave them in the 1st place.,2023-09
COMMENT_1bae1986,@[USER]  i think we should send you to south Africa are Islam because that is what you want to turn are country into .i would love to give you a Mandela necklace.,PRCT,True,0,True,3,"@[USER]  i think, empathy is very lacking in some people in these comments, jesus.",2020-07
COMMENT_cac6aa4f,"George Soros & Barbara spectre alongside their Jewish counterparts have fully enforced this policy. Unvetted immigrants, most males - adults not young boys, with criminal records. Europe is becoming sabotaged by these immigrants and the citizens are on fear, there’s exponential growth in rapes, murders, assaults, thievery and ghettos. It’s harrowing to watch the demise of one’s own country. There will never be harmony amongst 3rd world religious groups and their incessant hatred towards those that have gave them refuge. Dublin, Ireland is seeing this issue first hand. Stabbing, rapes, murders and fentanyl use are rampant.",PRCT,True,0,True,1,"I've been living in Sweden since the last two years and being an immigrant myself, I feel very sad for the Swedes. I've seen many who refuse to speak even in English let alone Swedish. I mean, Swedish is the easiest European language I've learnt and it hardly took me 6 months. I really hope the government comes up with strict policies that curb such violence. I'm proud to be paying my taxes and integration with the local people and their culture.",2023-08
COMMENT_d2eab560,"@[USER]-mp2yi  In the case of Germany, there are no illegal ""refugees"" coming from Cameroon, Togo or Namibia. And the Turks came in the 60's, when Germany has already been rebuilt and began to flourish again, inviting not only Turks but also Spaniards, Greeks and Italians as ""Gastarbeiter"" (guest workers) for a LIMITED time. Many didn't want to go back, but it was the second and third generations of Turks that began to isolate themselves when ultrafanatic mullahs were sent from Ankara to infiltrate all mosques and propagate the obligatory (a lie) wearing of arabic hoods for all muslim women and little girls, as well as to forbid the integration of muslims into the guest nation. The problems are seen in all schools (muslim students forbidden by their parents to attend biology, music and swimming lessons, excursions are prohibited!) and with the new young invaders, the female teachers are having the hardest time of their life.",PRCT,True,0,True,1,"This is not just a Swedish problem, but a problem faced by ALL European countries, God forbid you mention anything or you're called racist. We have lost our culture and our own people supporting them instead of supporting our own country!",2023-08
COMMENT_bf645f9b,Invaders not welcome here out out. O freebies,PRCT,True,0,True,1,I will pay for her ticket back! The arrogance of these people is outrageous.,2023-10
COMMENT_94f099f5,if it's legal you're cool with the invasion?,PRCT,True,0,True,1,ILLEGAL not migrant.,2024-02
COMMENT_d742fd72,"In my county in Alabama there is a wait list for up to 2-3 years for affordable housing for working AMERICANS!
If these people aren’t given free food and housing they are going to start squatting and stealing.
Our politicians are either out of touch with what’s going on in this country or the stupidest people on the planet!
I predict a huge backlash from the American people any day. 
Why Texas citizens aren’t organized at the border and turning these people back is beyond me.

Texans may as well pack up and move out of Texas, because they will soon be the minority there.",PRCT,True,0,True,1,"As a British person, I feel sorry for the people of the USA who thought voting for this would help them.",2023-09
COMMENT_ef67d129,💯💯  *ONCE AGAIN TRUMP WAS RIGHT ABOUT SOMETHING ..... THIS IS AN INVASION !!!!!!*  😳👈,PRCT,True,0,True,1,Kick the guys out of office there messing the country up on every level,2023-05
COMMENT_c3ca56c6,Both the Latin American government and U.S government are working together.Wake up it's all part of their plan.🤦,PRCT,True,0,True,1,Latin American governments should be held aggressively accountable for not protecting their people. Fines should be implemented on governments to place pressure on their lack of evolution in structures,2023-03
COMMENT_cbebd441,Guns stop invading hoards!,PRCT,True,0,True,0,,2024-11
COMMENT_30894a1a,"Kalergi plan, Hooton plan, Kaufman plan, Morgenthau plan, Nizer plan, ALL European countries have the same issue for years and now we are at the peak. Do we get ""Their"" dream of world government with all our demographics destroyed, or do we get our countries and people's back and work and trade together instead of mass mixing us all.",PRCT,True,0,True,1,"Saying Swedens integration has failed is an understatement. I live in southern Sweden. A lot of migration move here because of the mild climate. You cannot even begin to understand how bad society becomes after 7 years of unrestricted immigration on top of 20+ years of fairly high immigration. My own neighbourhood went from being calm, crime free and clean to having multiple shoot outs between criminals every year. Several bombs have exploded in the area too. There's vandalisation going on all the time. Every week something is damaged that you use. I've had 3 break ins during a single year. Rat infestation because people stopped taking care of the garbage means i can see literal rats running across the roads when i go to the shops.

I've spoken to migrants that been collegues that live in fairly bad areas in my city and they speak of parallell societies where local groups run both policing and even ""checks"" of anyone that enters the area. One collegue couldn't even have male friends over because women aren't supposed to have male friends apparently and she had one over that later got threatened by a gang of thugs with a knife. When i picked her up one day, i had to park 2 districts down so they couldnt see the registration of my car number so they could find me later.

A country isn't just its borders and history. But the people itself is the country. If you start replacing or filling a country with people of less developed and ultimately worse morals and way of living.. then you essentially change the country for the worst. This is ultimately, despite delusions and hopes of different outcome, that this is the reality.. and it won't change.

And the politicians aren't helping. The latest change for example is that they want to remove the grade F because too many migrants fail even primary school, so in order to still get them through education.. they simply want to remove the grade F for these people. Just to give an idea of the level of seriousness our politicians are taking it.",2022-09
COMMENT_3157e9d5,"@[USER] sorry drag queen story hour the one who's going to prison is Fanny Willis and her boyfriend.
Donald Trump is going to be the next president of the United States because the Democrats won't be able to cheat enough this time to keep him out of office. Then he's going to mass deport all the low IQ violent welfare suxin Invaders which means the Democratic party will have no future.
I can't wait to see Donald Trump's new head of the doj LOL",PRCT,True,0,True,2,@[USER] 5838 😂😂😂,2024-02
COMMENT_84329fa7,"@[USER] it's more than 13 million and counting, the potato thinks they're all going to vote for a potato! FJB and FDUMBOCRAPS! TRUMP 2024🇺🇲🇺🇲🇺🇲 take back our country from the potato's criminal regime and MAGA forever and stop the potato's illegal aliens invading our country! SEMPER FI 🇺🇲🇺🇲🇺🇲",PRCT,True,0,True,3,Its more than 2 million ​@[USER],2024-02
COMMENT_eeef2f9f,@[USER] More than that. Demog raphic replacement,PRCT,True,5,True,2,VOTES,2023-08
COMMENT_8596d95c,@[USER] This is a concerted effort to destroy western nations.,PRCT,True,0,True,2,"Excatly. We have homeless families in the UK waiting for years for housing and instead new asylum seekers are straight to the top of the queue - free housing, free food.",2023-09
COMMENT_7b8d04ca,"To replace and fight Blacks,  but after that they are coming for the whites!",PRCT,True,0,True,1,"I can't help but think there may be another reason so many people are just being allowed in our borders. Usually, someone, or entity is and stands to capitalize financially. 
It's never the immediate working class, nor the regular American people. 
If it weren't profitable to a powerful entity'(s) it just wouldn't be happening .",2023-01
COMMENT_ee349620,I agree the anti immigration but our invasion wasn’t a immigration it was a conquest which is what the other native tribes did to eachother,PRCT,False,0,True,0,,2023-08
COMMENT_42895fbe,This is an INVASION! CLOSE THE DAMN BORDER!,PRCT,True,0,True,1,"The crazy part is that it’s not just Mexicans. It’s Armenians, Russians, Asians, etc. as a Mexican it’s really not good to be letting all these people into the US that easy.",2023-04
COMMENT_4ee583df,"@[USER]  Ive been thinnkinng about that for ages. We live in democracies, and we huwhites have way lower birth rates. Put 1 and 1 together. The one piece of schadenfreude that is making me laugh is, all the people on the far left, campaigning for this, will be the first to be criminalized in the new world they wanted so badly.",PRCT,True,0,True,2,"the scary thing is that Swedes are expected to become a minority population within 30 years.

of which the Islamic political blocs are expected to be able to get more votes than Sd.",2023-03
COMMENT_95eda6c9,"If our govt has allowed invasion it's time to take back our country, that's our right! Get the men to all borders!",PRCT,True,0,True,1,We need to put our politicians in jail for treason.,2023-05
COMMENT_9574cec7,"@[USER]  *Saying in a calm and collected tone of voice* It seems that the whole having many children is more of a thing families from immigrant countries have, not native Swedes; It’s more of a “We’ll have however many children we decide to have, no pressure on either of us”, and if that so happens to be either two or eight, that’s up to the couple 🤷🏻‍♀️ It might be ‘forced’ upon couples in certain other countries, but in Sweden, you aren’t. That’s not to say that there aren’t big families here, because I don’t doubt that there are, but if there are, it’s out of choice, because you want a big family, not because someone told you to. Couples shouldn’t HAVE to have a huge family to avoid being ‘extinct’ in their native country due to (people are going to hate me even more for saying this, but I don’t know any of you, so I could care less, not being offended by what complete strangers say or think about me - Yes, a complete stranger can call me all types of names without even knowing me, and I wouldn’t cry over it) ‘mass-immigration’ 😕 It’s a sensitive af subject, everyone knows that, but I’m not woke, so I’ll speak my mind, and keep my fingers crossed YouTube doesn’t think what I’m saying is ‘hate speech’, because it’s someone who’s worried about their traditions, culture, and language 🙄 (Remember, before using the ‘R’ or ‘X’ word, that I have mentioned in one of the response-comments, growing up internationally, as well as having both a diverse and international family)",PRCT,True,3,True,2,"I love the Swedish people, but you really need to have more children and stop going pro-woke too much :) ... I used to love to visit Europe to change scenery from what we have in the Middle East, now it is worse...",2023-03
COMMENT_c9de41c3,It's the same in the UK.We want our country back from illegal invaders and I wish they would deport all illegals.They don't respect us or our culture.,PRCT,True,0,True,1,Sad thing is the politicians that forced this upon Sweden. Will never be punished.,2023-10
COMMENT_af53b25a,"Reagan did amnesty for about five million that have been in the country up to decades. This regime has allowed up to 50 million in three years to just walk in. For a country that officially has less than 330 million. Do the math, genius. The goal is to destroy America, as we're an obstacle to the one world state they want so much.",PRCT,True,0,True,1,Those guys seeking asylum are better dressed than us...,2024-02
COMMENT_7d16c2c7,"India Corea You're just a hateful, racist bitch that projects her own racism. You think that race is a property right to this great country,  and you resent people for things they literally had nothing to do with. By the way, border security is a national security issue, and you people are fools for allowing your ancestral homeland to be invaded by anyone ever again. If most of the Native Americans feel the way you and this racist asshole in this video do, you're just pawns for a sinister agenda.",PRCT,True,0,True,1,"Brother as a native Cherokee your so right. About time somebody told the truth. I don't care how long it's been. we still aren't treated as equals. Isn't that a shame!!! Wow we have small pieces of land called reservations. Maybe we should reserve everyone there small piece of land...see how you like it,come back and let me know if that makes you angry. Even if people hate me and my native American Indian family. I still believe in peace and unity. I give praises to mother earth,and praises to our higher power. Were still here and we aren't going away. And so we must find a way to coexist. Proud to be another Cherokee...Qualla Nation forever",2017-11
COMMENT_7694e236,This is literally the definition of ethnic cleansing. I feel so sorry for young Native Swedes. They have lost their homeland.,PRCT,True,34,True,0,,2022-05
COMMENT_12b24293,"@[USER] they're trying to outnumber us so they can take over, they know they can't use the typical invasion strategy bc we have too many armed civilians.",PRCT,True,0,True,2,This is mind blowing. I just don’t get WHY,2024-02
COMMENT_aa243838,I guess people arent aware that all this uncontrolled immigration to North American and western European countries is a plan to destroy them. Do research.,PRCT,True,0,True,1,"This breaks my heart to see, and it’s not just happening in Sweden.  Germany, UK, Italy, and France are all dealing with the same problem.   Should stand as an example why strong borders are essential for a culture and country to survive.",2023-08
COMMENT_c9c09142,"Yes, they should not be using the schools, for the ungrateful people who invaded our country!!!",PRCT,True,0,True,0,,2024-03
COMMENT_9d1a7988,"The migrant's luggage looks nicer then the luggage I have hahha.  All these people are are votes for Biden, IDK if its already been written or not but I am sure they plan to let them vote.",PRCT,True,0,True,0,,2024-02
COMMENT_909d4743,"They are being brought here by Soros backed organizations, they are importing socialist so they can vote for it here too!",PRCT,True,0,True,1,"Yes, I didnt think it would stop people. If you walked here from Venezuela or any other country, do you think a row of floating balls is going to stop them?",2023-08
COMMENT_f03495c6,Just like us in the UK and Europe except we have been practically taken over. White indigenous peoples are no longer the majority in our capital and many cities and towns have been taken over. The UK has fallen 😢,PRCT,True,15,True,1,If they hate America then what are they doing here in America.,2024-02
COMMENT_b4bddf68,"@[USER] why then do Arabic (Quran language learnt by rote by non Arabs in every Madrassa worldwide) do they not migrate to an Arabic speaking country such as  the Kingdom of Saud rather than the Kingdom of Sweden or the Republic of France rather than the Islamic Republic of Iran? Is it not strange that the vast majority of Muslim immigrants and Asylum seekers head for Christian non Arabic speaking countries rather than Islamic states. Two explanations spring to mind, one being the benefits paid by western societies, but not Islamic governed countries, or it is a planned expansion of Islam by the back door?",PRCT,True,2,True,7,"@[USER]  origin is middle east but its european religion which ofc shaped all of european history and culture and still does today. All those countries you named are secular countries where there is no state religion and for example in Bosnia or Albania Muslims make around 50% of the population, so its not even majority religion. I should add that the form of islam there is very very liberal as i have visited Albania and Bosnia. You rly wanna start a debate with history graduate lol claiming something that christianity is from middle east and there are muslim minority countries in the Europe. Also its Europe not Eu if you even know the difference 🤡🤡 whats even the purpose of your arguments, i see zero value in them.",2023-08
COMMENT_676854b9,Looks like America will ne native again soon,PRCT,False,2,True,1,"Listen, I am proud to be Navajo but I feel bad for my ancestors since they had to hide from the Europeans and we were chased off to New Mexico and many people don't know this but Mexican is honestly just a label the Europeans gave them Mexicans are actually natives too its just we had to take the label in order to survive and I hate how the schools are in the cities so I live on the Gila river Indian reservation and I'm proud to be most times because when I wake up and go outside I don't hear cars or traffic and loud neighbors I hear the birds and the wind and seeing the sun in a clear view and being able to see the stars at night and when I'm happy when I wake up because instead of waking up and staying inside I get to walk outside with the dirt touching my feet and feeding my sheep and seeing the beautiful desert it is honestly an amazing feeling that many don't understand.",2019-03
COMMENT_edd2d41e,they were invited by the passive people of Sweden puppeted by the globalists.,PRCT,True,0,True,1,"As an American who is planning to move to Gothenburg and assimilate properly, it infuriates me that people think they can migrate to another country while ignoring their social standards, culture, and/or flatout engage in bad behavior. I feel for the Swedes who are affected by bad immigrants in their country 😞❤️🇸🇪",2023-03
COMMENT_0b91aeef,"@[USER]  your government destroy their society and any of you complain about it.they want to have a decent life as well, and they are using the only legal way for them. Let's make America native again.!",PRCT,False,0,True,3,"@[USER] by the way, other people shouting “you’re not welcome” is their first amendment right. Don’t try to silence others. You shouldn’t even enjoy the freedom which the bill of rights grants you. It’s sad to see people like you wanting to destroy our society.",2023-09
COMMENT_c0bcf5d7,"@[USER]  100% invasion and should be treated as such up to military lethal  action . And don't cone with bs. My wife immigrated here, and she said the same thing",PRCT,True,1,True,2,@[USER] gave up texas......it only took 18 minutes,2024-08
COMMENT_d26f9207,"@[USER]  so you have it like that in germany too?! We have it like that too We cant voice against this madness in fearness of losing our jobs, I want to speak against all this Madness loudly so badly! I hate people from the middle east that destroys our countries",PRCT,True,2,True,3,"@[USER]  it is a tabu to speak about to ""loud"". You can easily loose your job,  if you talk about touchy subjects at work. If you tuch those subjects, you always risk to get stumbled as racist or nazi.",2022-06
COMMENT_73c1f9ab,"Oh no, it's only in white countries. It's called replacement.",PRCT,True,0,True,1,Cannot believe this is happening worldwide! I’m in UK and didn’t realise how bad it was in US also 😡,2023-09
COMMENT_165bdf07,"@[USER]  then you're a criminal. Cant afford housing in usa 
These people have no right . invasion.",PRCT,True,0,True,2,"Hold on!!! We have more than enough in this country!!! The problem is that TOO MANY AMERICANS TAKE THIS COUNTRY FOR GRANTED!😠
I've lived 12 years outside of AMERICA, and from the point of the Foreigners. 
I WOULD DO THE SAME THING!!!",2023-03
COMMENT_f781c7b9,"@[USER]  yes Swedish culture is at risk, even more so than other European cultures, who are all facing extinction. Cultural exchange is good, cultural dilution or cultural replacement is bad. Sweden fertility rate (native) is well below replacement levels  (you can thank your much beloved Scandinavian feminism for that) and Swedes WILL become a minority in their country in 20 years. When you become a minority in your cities and lose representation in your institutions, nothing will stop the anti-white sentiment. No “hate speech” legislation is gonna save you, no “diverse” tribunal is ever gonna take your side, you will only be seen as tax farms that keep the welfare system working (though it will serve immigrants more than it will serve you). All you have is your tribe and your land, if YOU don’t protect them nobody will.",PRCT,True,0,True,9,"@[USER]  Ah, so we have a conspiracy theorist at our hands. Lovely.",2023-02
COMMENT_07a0022a,Compliments of George Soros. He's behind all of this.,PRCT,True,0,True,1,It's awful funny how clean their clothes are after just crossing the desert. They all have brand new shoes on.,2024-02
COMMENT_47b0a9e8,Here in Europe it's the same / maybe worse....by now 100% convinced it's intentional/a plan.,PRCT,True,41,True,1,It's sad that this is what our country is becoming 😓,2024-02
COMMENT_5dc8e6d7,Hostile foreign invaders,PRCT,True,1,True,1,These are NOT MIGRANTS!!!!!,2024-02
COMMENT_9786f80c,This is an enemy invasion.,PRCT,True,346,True,0,,2024-02
COMMENT_93006684,We will replace you pale Orcs.,PRCT,True,0,True,1,"We can send spaceships to the moon, Mars, etc. but we can't get a handle on this!!??",2023-03
COMMENT_04145b2d,"China sent them here. There’s no way anyone in China could escape their mass surveillance system. Most of them military aged men with no families. Nothing to lose, more willing to do horrible things than men with families. There’s economic opportunity all over the world but they traveled the whole way here. It’s an invasion",PRCT,True,0,True,1,"The scariest part is Chinese won't take them back. Thats wild , they know theyre gaming the system.",2024-02
