CommentID,CommentText,Model_Classification,Annotation,NumberOfLikes,IsReply,Level,ParentCommentText,Timestamp
COMMENT_1cb0f2d0,MY THOUGHTS EXACTLY.. JUST LET YOUR INVADERS WALTZ IN,PRCT,True,7,True,1,What an EASY way to assemble your troops within a country without getting caught doing so.,2024-02
COMMENT_10be0d98,"@[USER]  So why don't you actively support the genocide of all the Europeans because they are guilty of their past? This would solve your problems. Maybe we should do the same with the slave trader African nations too, the Asians etc, everyone! What a joke! ""Only the white European man is the devil and a demon. Everyone else has a right over him"" People who support this kind of beliefs are the worst fascists, bigots, racists in the whole world. Disgusting!",PRCT,True,0,True,3,"@[USER]  I don't believe that is the case at all. Unfortunately there are certain realities that hold stronger weight than your sentiments on national identity and homogeneity, which are economics and innovation. If Europe is where it is today, it is because of its wealth. And that isn't sustainable given its population trend. And the reason the US is so successful is because it attracts the best talent in the world, including Europe. If Europe wants to have a competitive edge in things that actually matter, then immigration is unavoidable. Besides human migration is more natural than you believe. Our concept of rigid nation-states is much newer than you'd like and very unnatural. Also, nobody should ever feel unsafe anywhere. That's a fucked up thing to say. And lastly, no European has any right to claim this given their history and legacy of colonising and plundering half the existing world.",2022-06
COMMENT_9ac36691,"Not trying to be rude, but isnt Britain plagued with muslims the same way were flooded with mexicans lol",PRCT,True,0,True,1,"As a British person, I feel sorry for the people of the USA who thought voting for this would help them.",2023-09
COMMENT_8fb1c0fa,"James Perkins 
Every single Native American whether Mexican or Canadian or South American have a right to travel freely throughout the Americas.
They did not create these silly white mans borders.",Non-PRCT,True,2,True,1,I love how they don't say anything back because they know he's right.,2020-10
COMMENT_a836257d,"Well that's your problem. Next time be smart and cross the entire south American sub-continent via the jungle, with all your earthly possessions on your back. You guys are stupid doing it the hard way. Did you take a plane or a boat? That fare is wasted money you could've used to try and bribe the cartels to save your life. What a waste.",Non-PRCT,True,0,True,1,"We came to this country legally, this is unfair. We waited 25 years to be approved.",2024-01
COMMENT_920717fe,A lot of these people are indebted to groups they wouldn't dare cross. They have to work shit jobs when they arrive to pay off debts and to send back to their family. It was not an easy journey and many die,Non-PRCT,True,26,True,1,"I'm a European immigrant and it was NOT easy to immigrate. This is not only shocking, but just not right to put it very mildly. EDIT: I am all for political asylum. But this is clearly not this.",2023-10
COMMENT_03ad0c90,@[USER] let’s be fair. Look it up. Mexico welcomed them into their land. After a while. Those colonizers started to our number Mexicans 10-1 like what your seeing now. When that happened of course they wanted their own liberty. So a war broke out. It’s in the history books,Non-PRCT,True,0,True,2,@[USER]-s9r7x when the first colonists came this land was a wilderness… this is a country with a civilization now. Get your story straight.,2024-02
COMMENT_29eeb6ea,"Not all pregnancies are planned, numb nuts. Ask your mom - you were probably an accident yourself.",Non-PRCT,True,0,True,1,"If you're so desperate/poor, why are you having a kid? Defies all logic.",2024-03
COMMENT_546d4b9e,"@[USER]  People who are born here are natives. Oh, wait.... You're trying to bring up something that happened hundreds of years ago and apply it to current events. Yeah.... That doesn't work, Nancy. Times change, laws change and people change. If you wanna go that route, no humans are native here since they immigrated across the land bridge about 20k years ago. You're saying that the indigenous people illegally immigrated here, too.",Non-PRCT,True,2,True,2,"The difference in being legal or not is a piece of paper that the government gives you.
Actually the only legal ones are the indigenous people, the rest are emigrants from Europe and other places.....legal or not",2023-08
COMMENT_de564158,Tell texas to stop selling guns to foreigners like the cartel,Non-PRCT,True,0,True,1,"Mexicans and Guatemalans need to do this to the Cartels.
Venezuelans need to do it to their own government.",2023-04
COMMENT_879f737f,"@[USER]-nt5eq drool worthy sofrito is so good with some beans & rice. My mom & her family are from Colombia which sofrito, rice, beans, yuca, plantos, arepas and all that is a huge staple of my diet along with the extra food that comes from my Mexican American fathers family side.

My whole point is some folks are extremely ungrateful and simply can't be happy with what their given especially with food my God it's going to fill your belly & keep your alive..",Non-PRCT,True,3,True,1,"The crazy thing is most of the people who come to the US to seek asylum or a better life and are super ungrateful and expect everything handed to them are South/Central Americans. My grandparents came to US and had to start from the bottom and from nothing and worked their way up to build something for themselves and our family. The audacity when they’re in Mexico waiting to cross and are super disrespectful to the locals who feed them and help in any way they can just to complain about them being fed beans, rice, and tortilla or as they call it “dirty food” “poor food” ??? 🤨…. like do you realize the conditions YOURE coming from. I can go on…",2023-10
COMMENT_10feb928,"@[USER]  So it's not a problem unless it affects you personally, directly and immediately? Nice

It runs the same for everyone. Take the Afghan refugees who aided the British, currently at risk of being murdered by Taliban or similar in the UK. Or what about gay people fleeing Iran and SA where they are hung from the neck till dead in public squares and thrown off tall buildings.

Or is that insufficiently wide for you? These were all examples from people I know who are immigrants. They left their home countries for a reason, blindly allowing the worst parts of their home that they're trying to escape while thinking you're smugly inclusive because you allow any crime so long as the person is non-native. Ask immigrants who're affected by the sorts of things I'm describing, try telling my friend Armin from Iran that the religious persecution for being Bahai and homophobic persecution within the immigrant Iranian community is just his failure at understanding and compassion about these awful people to whom we provide shelter and support. Good one, nice.",Non-PRCT,True,0,True,3,@[USER]  or you could just use a more reasonable and more widely used example than some extreme example that is rarely a problem.,2023-08
COMMENT_10f3008e,"really....how do you know that.  first of all ask yourself this.  why are there refugees?  people generally dont leave the sanctuary of a familiar environment.  when iraq was invaded with the fake WMD and libya destroyed beyond repair by you know who....the people flee deaths destruction and nothingness including the africans who benefited from the employment of these countries' vast oilfields until they are destroyed b eyond repair.  therefore those who are complicit in these destructions like ssweden and the coll west should not complain.  if people are treated well regardless of culture religion and colour of skin they will give respect.. as you are fully aware, when the economic chips are down ,  it is always the minority who bear the brunt of the majority's frustration.  the european economy is shitty atm because of their financing the war in ukraine against russia...so there.  they shot themselves in the head!!!  and the refugees are being blamed hence racism is rearing its ugly head again....the european people are so apathetic by not protesting against their countries'  vicious belligerence towards russia and the sending of huge amount of money in an unwinable war that could have been spent on them and stopping the flow of cheap russian gas/oil into their otherwise prosperous economy before this silly war happened.",Non-PRCT,True,0,True,1,"As an immigrant to Australia, when we came we liked the idea of democracy and freedom and we looked forward to integrating into Australian culture. We learnt english, participated in social events, celebrated australian holidays, supported australian sports teams, learnt australian recipes AND we also kept our own language and culture and introduced our friends and neighbours to our culture. Its ok for our culture to be a sub-culture within the larger australian culture. I don't understand this immigrant attitude where they escape their own crappy country, migrate to a western democratic nation and then want to turn it into the sh*t hole that they just left.",2024-03
COMMENT_3238d15c,"walruspictures Is there a place that I can go without being bothered by you masses? If not then I'll die too. Listening to all the masses who deny us our rights and counter against everything I stand for. I am losing hope of this mass of humanity. I live in California maybe some can understand the population explosion coming from around the world. They used up their resources killed off their native wildlife and now they want what I have. Well I'll always be on the right side, but isn't your grass green enough on your side? When will you stop? When Nature stops you, Soon i hope! I'm waiting, otherwise all hope will soon be lost. It's not too late, but time is running out. So much ignorance and hate.",Non-PRCT,True,1,True,1,"I hate it when they say that natives didn't care about land, and shared everything. They didn't discover agriculture, and were nomadic. Even then, they were still killing eachother over the best hunting grounds, I'm dead serious.",2014-05
COMMENT_814d3465,@[USER] this nation was not unified in the slightest when we came here that is a horrible argument because there was nothing but children with sticks which we replaced with the most dominant superpower on earth America is ours not theirs,Non-PRCT,True,1,True,10,"@[USER]  not really sure I understand your point. One thing I can tell you for sure, is that you did not arrive as slaves (if you are white) 😂😂😂 like……wtf are even talking about 🤷🏾‍♂️",2023-09
COMMENT_20c98c6f,"This will never stop since farms and meat processing plants need cheap labour. And we all know big companies are the real rulers of the US. 
Unless you american cowboys are willing to work the fields instead???!!",Non-PRCT,True,0,True,1,I’m from Texas. Glad to see that the rest of the country is getting to experience and understand what southern border states have been dealing with for decades. Maybe now the rest of the country will get on board with shutting down the borders.,2023-09
COMMENT_f1a6afb5,Democrats are destroying this country,Non-PRCT,True,0,True,1,I’m from Texas. Glad to see that the rest of the country is getting to experience and understand what southern border states have been dealing with for decades. Maybe now the rest of the country will get on board with shutting down the borders.,2023-09
COMMENT_aeafc714,"I mean whites felt entitled to come to this continent and cut down millions of trees to engineer climate change as well as commit MASS GENOCIDE on natives after stabbing them in the back, then enslaving a group of people, then have audacity to tell OTHER people they can’t come into this country when THEY are the Original “Immigrants”.🤔🤗",Non-PRCT,True,0,True,1,Mexico has to close its borders to central americans,2023-04
COMMENT_f0810acb,"Faild countries and most war-torn 3rd world nations people have no idea how to live in other countries without causing issues. Australia was founded and created by British settlers. Migrants of other European countries can simulate themselves with some similar cultural background but mostly based on shared values and religion with people of Australia that are based largely on European  Western values.

Muslims can not integrate themselves in any Western nation as their whole tradition and values and law is based on religion Islam. 

Some other people like South sudanese African. Are Christians.  But they come from a failed nation that has been ravaged by constant  civil wars. Some people just can't integrate into any other country as though people themselves have issues and just don't  know how to behave as to why their own country  is always and civil war.

Then there are some people who're from 3rd world nations or from developing countries who can't integrate into other nations as they keep with their own  communities and silently try to take over they also causing issues.

Multiculturalism works with similar cultural norms, background religion, and shared values.  But if you bring the whole world in. You will have issues in your nation. And could end in blood",Non-PRCT,True,0,True,1,"As an immigrant to Australia, when we came we liked the idea of democracy and freedom and we looked forward to integrating into Australian culture. We learnt english, participated in social events, celebrated australian holidays, supported australian sports teams, learnt australian recipes AND we also kept our own language and culture and introduced our friends and neighbours to our culture. Its ok for our culture to be a sub-culture within the larger australian culture. I don't understand this immigrant attitude where they escape their own crappy country, migrate to a western democratic nation and then want to turn it into the sh*t hole that they just left.",2023-12
COMMENT_bd134db7,"We are the Indigenous Peoples of this land, BEFORE it was called America. All tribes have a word in their Native tongue which simply means ""the land"". Remember this.",Non-PRCT,True,0,True,0,,2021-02
COMMENT_8008d280,Well U.S has already destroyed most of latin America so... I'm not saying what's happening is right but the U.S is responsible for a lot of these problems 😊,Non-PRCT,True,13,True,1,Let us try that in their country and see what happens!,2024-02
COMMENT_dad59d97,"@[USER]  this IS our land though,has been for over 150 years.

But fine ill go by your logic,they arent invaders,they are Colonizers",Non-PRCT,True,0,True,4,"@[USER]  
I just googled texas there was war between yanki and Mexican it was stolen as I thought",2024-04
COMMENT_7320903c,These countries aren't sending their brightest or their women!,Non-PRCT,True,2,True,1,This is freaking DISGUSTING…..!!!!   Some people did things AND THEY WILL PAY!!!,2024-02
COMMENT_bdad3f99,Johnnyrocket Fromearth   Are you a native ?,Non-PRCT,True,0,True,1,I'm Native American THIS IS MY LAND!!,2018-08
COMMENT_a0bb3731,If they fix it the next day the Mexican Cartel break another fence 😂,Non-PRCT,True,27,True,1,"What's crazy about this, is that the ""hole"" in the fence could literally be fixed in an afternoon.",2024-02
COMMENT_fd3ffe52,They need to sending back is cost less,Non-PRCT,True,0,True,1,As a border town citizen.. it's wild how the media states its all fine... PEOPLE NEED TO OPEN THEIR EYES!,2023-10
COMMENT_3aa2d6e3,Send them to Biden’s house,Non-PRCT,True,1004,True,0,,2023-11
COMMENT_7185e7ea,They don’t send their best,Non-PRCT,True,0,True,0,,2024-03
COMMENT_4b97be5b,@[USER] West  I'm clearly talking about the Spanish descendant who claimed to be native of North America while being full blood Spanish descendant and only speaking Spanish what's your point ?,Non-PRCT,True,1,True,1,"As a Mexican i feel sad for this immigration mess. It's just destroying thousands of years of culture and repetition of costumes, language, songs and food. It's what makes every country unique and distinct from another.",2023-03
COMMENT_43bef3d3,@[USER] Exactly stolen land from dark face Native which are black face people.  Which are called black Americans today.,Non-PRCT,True,1,True,2,@@[USER].2325 your ancestors stole it so chill. It’s jus Karma coming for y’all,2024-02
COMMENT_e3131e60,"@@[USER]  the USA had the help of many other countries like britain, france, canada and many more powerful countries, also that is very oversimplified. The USA was scared of losing their foothold on the world and didn't like other countries having communist-sympathies so they would go in to get rid of the leader and put a puppet in control or have the rich go and buy up all the land like they did with banana republics. Their has never been a communist country just oligarchs and dictators posing as communist. People in power don't need to change because we the people won't make them change.",Non-PRCT,True,0,True,1,Bring in the National Guard and close our borders.,2023-10
COMMENT_1fec212f,"Ross D I'll be honest. I don't think Americans really understand Canada. It's a country where about 25 percent of the population have indigenous ancestors...if not more. That affects how you think about your neighbours and the planet.  We have each other's backs and we try to be good guardians but our own communities come first. It's  both liberal and conservative.

As for refugees there actually is not limit. There isn't in the US either. A refugee has to have a credible fear of persecution and they have to prove it in a court of law. The difference lies in how much harder it is to get to Canada.  We don't have the numbers and we don't have the backlog...the US is 9 years behind in the immigration courts but we can just increase the number of courts and officials as needed. In the U.S. many waiting just disappear before their hearing but in Canada they are pursued by law enforcement.",Non-PRCT,True,0,True,1,"I’m an independent (and I mean it, I feel zero in common with either party right now). 

With that said, I live in San Francisco and work in tech. There’s the STRANGEST thing here. People idolizing Canada as their liberal shining star of a country. 

But uhhh...they greatly limited their refugee intake as well. 

Remember those oil pipelines you were so against? They start in Canada. Canada’s prime minister who you love, was the one applying pressure on the US to allow them to be built. 

But hey, they got universal healthcare. 

...but that’s literally it.",2018-03
COMMENT_a7d77b3f,"@[USER] well make them legal faster and we 1) won't have to pay for their housing or 2) just give them 1000 dollarydoos and send them away

aka get rid of legislation that tells us to give them free housing and food and such",Non-PRCT,True,0,True,1,This is a slap in the face to all those who did their paperwork and came here legally. It's a slap in the face to all the citizens and LEGAL immigrants (not illegal aliens) who work and pay taxes to fund and run a civilized country!,2024-02
COMMENT_28a2b565,"@[USER] Moving to Canada is not worth it. Housing market is out of control. Avg home is sold at $900K and rent reached $20 per month this year for a one bedroom apartment. It doesn't help that Trudeau wants to bring in 500,000 immigrants per year. This year, they are projecting to build 250,000 homes. The math doesn't add up. I'm planning to get OUT of Canada.",Non-PRCT,True,0,True,3,"​@[USER] yes Canadá does accept skilled people but not to work in their professions but as manual worker,s, even doing menial work. It's quite hard for a professional to validate his or her diploma in Canada.",2023-09
COMMENT_01f152ac,"This Immigrant Left the U.S. To Seek Asylum In Canada And Regrets It... ok but well they all regret it? This might not be a bad idea for someone, well in his case he is separated from his child but damn. It would be just so perfect get into the US while air plane tickets cost less, over stay your welcome lol, and then get out of America even though Trump is no longer President because America is always going to be crazy and then stay in Canada. Really if they are fling they should just go to Canada.",Non-PRCT,True,0,True,0,,2021-01
COMMENT_d0327ad5,Probably what native Americans wanted some two hundred years ago. These people are just looking for a chance to live. You’re lucky you don’t have to flee your country.,Non-PRCT,True,0,True,1,They need to fight in their country for their country.,2023-06
COMMENT_29359528,"whose farm subsidies destroyed agriculture in central and south America? Whose drug war is destroying their countries?

I'd say anyone from any of those countries is welcome, given what our govt is still doing to ruin their economies, so ours can use crony capitalist methods to out-compete them, instead of living up to our free market principles as a country.",Non-PRCT,True,0,True,1,Economic migrants not asylum seekers..,2024-02
COMMENT_7d61b74f,"@[USER]... Kids aside, stand up for yourselves!! 

If there were no children in the vicinity or on the island, this would still be an unlawful act on the part of this administration to force you to actively participate you in their (continued) social engineering. 

You do so at your own demise.",Non-PRCT,True,0,True,1,Congratulations Staten Island!! Stand up for your kids!!,2023-08
COMMENT_112a965b,"I'm an immigrant, and I've also spent some time in Sweden. The native Swedes were friendly and helpful, the immigrants were not. NOT saying that all of the immigrants are like that, BUT there's a clear contrast that shouldn't be ignored. I found it interesting because I was staying with my Danish girlfriend in her Copenhagen apartment and during my time there I noticed how they (a city that has a bridge to Sweden) didn't have the same issue. That's because Denmark isn't a fan of immigrants, they're VERY picky. I don't think boarders should be closed, but based on what I've observed in real life, they should just be less open. It works.",Non-PRCT,True,31,True,0,,2023-08
COMMENT_34eea557,You should go to the beach. It’s really nice. Take a plane or drive if you don’t live close enough. Invite your significant other too. Byeee 🌊,Non-PRCT,True,0,True,1,"I'm American, and I've never seen the ocean or a skyscraper. I've never held my partners hand on the beach and felt whatever it was you felt. 😟😮‍💨🙄",2023-05
COMMENT_b56aaf64,@[USER]  oh they absolutely will they do!! America actually treat them better than they own minorities BELIEVE THAT If our government treated them as other places treat us I assure you they wouldn’t be so bold this is disgusting,Non-PRCT,True,0,True,2,"​@[USER] Slough  
Massive detention camps popping up all over Texas and Mexico",2023-04
COMMENT_a9ef7140,"@@[USER].AP0L0_ the native american were conquered, it's called history, you're saying native americans were here last 1 million years? You don't think they took their land from some other tribe of people? Today it's the USA's Land and unless some other country takes it over it's ONLY USA'S LAND",Non-PRCT,True,0,True,1,"As a foreigner who worked to secure a legit business visa, I find this really odd. I had to invest more than $2 million in my US business along with a ton of paperwork just to visit for 1-2 months a year, while these guys just crawl under a damn fence and the US authorities watch them like it's a pedestrian crossing.",2024-02
COMMENT_a70e94ec,"As someone who travelled in Scandinavia for over thirty years, I can say the Swedes, by and large, never wanted immigration on such a scale. The policies that have allowed the present-day situation to come about seem to have come from politicians who have some weird agenda, and who've drip fed acceptance into the Swedish consciousness.",Non-PRCT,True,114,True,0,,2023-07
COMMENT_2ad457fd,"@[USER]  why dont you house 20 unvaccinated, unvetted, grown pedophiles in your tiny Apt, I'll even send ya a free box of strawberry pop tarts to ya feed em.",Non-PRCT,True,0,True,5,@[USER]  just wear a mask Karen,2023-08
COMMENT_1288b878,"***** No it wasn't right. I wonder if some have actually met a Native American. If people forget their history they will repeat it but the oppressors will be on the other end. We are all the same, fighting for what? I'm struggling for self respect and dignity in a dog eat dog world. We should be individual sovereigns who happen to be this or that race... Not Rats or swine fighting over crumbs.",Non-PRCT,True,1,True,1,"I hate it when they say that natives didn't care about land, and shared everything. They didn't discover agriculture, and were nomadic. Even then, they were still killing eachother over the best hunting grounds, I'm dead serious.",2014-06
COMMENT_7331b788,"Yes I'm aware of that, but those ""native americans"" wouldn't be considered native american here in latin america, where there are WAY more real native americans than in the US, yet they're still the most marginalized group in the continent and you as a latin american should know that it is us the mestizos who discriminate them. 

I'm all for the recognition of their culture but someone that looks mostly black or white claiming to be native american just to get benefits just seems like a shameless opportunist, and it also appears to me that the only reason why people who are less than half native american can be considered native american in the US is because the English colonizers practically genocided the north american natives to extinction and so they consider anyone that has any % of native DNA a native american just to say ""look! they're still here! we didn't kill them all!"".",Non-PRCT,True,1,True,1,"Mexicans & other central Americans are not from Spain, they are also native American.",2018-05
