CommentID,CommentText,Model_Classification,Annotation,NumberOfLikes,IsReply,Level,ParentCommentText,Timestamp
COMMENT_d04b85c9,It's not easy to return. Airlines don't give u free tickets back to Venezuela. 80% of americans earn less than 5k a month. Even if her man starts to make 4k a month they're still gunna be poor forever. No one tells people how the American dream is fake. It's literally a dream. White women have destroyed America and single black mothers have destroyed the black community. Giving women power will be in history books 200 years from now saying that was the cause of the fall of the United States. Giving white women all the good jobs that pay over 70k a year before black men were given good jobs is absolutely disgusting,Non-PRCT,True,0,True,1,"She says she regrets coming to America, yet here they are.  She didn’t mention any plans to return to Venezuela.",2024-02
COMMENT_526b87a5,No one will understand the truth about our earth native Americans were here maybe we should tell our alien race neighbors from space how they gave us lands and based our lands off there home planets and they will gladly tell us or maybe people can do real research and find out themselves and it will tell you how alien races came to earth back than in the ancient days to start civilizations and name the lands,Non-PRCT,True,0,True,0,,2021-02
COMMENT_d1afca2b,"@[USER]  not anymore actually.  After the plandemic the Chinese economy took a nose dive and many foreign companies have pulled out since, moving their factories to Vietnam, India, and Mexico",Non-PRCT,True,1,True,2,"Truly ironic 
a man travels all the way from chyynaa to find work 
meanwhile all of the US jobs are going to chyynaa .    LoL 😂",2024-02
COMMENT_ae4a31cb,@[USER] Specially when so many thousands and thousands of people are applying.  The system is overwhelmed.,Non-PRCT,True,3,True,1,So they are upset that they couldn’t just cross into the US and be citizens? Whether you go to Canada or the UK or US there are processes to follow. America is no different and applies equally to all people. You can regret your decision but the US has done nothing wrong.,2023-01
COMMENT_9330d32d,Nobody owns anything.  Even the first settlers came from Asia. Or from whatever they came from.,Non-PRCT,True,3,True,1,Borders laws should be followed,2023-04
COMMENT_d9615230,@[USER]  I told the immagation services in south America I don't understand my country is welcoming your citizens with open arms giving them free hotels free cloths free food free cell phones free medical benefits free bus and plane ticket and on top of all that they even giving them free pre paid visa cards with as much as 5000$ on them. And your treating an American citizen like this basically extorting me for 600$ because I over stayed my visa for three months. They guy said that's your stupid counties fault we have rules here and we are strict 🤣🤣🤣🤣🤣🤣🤣🤣🤣🤣,Non-PRCT,True,4,True,4,"​@[USER] I heard they have modern Cities that are completely abandoned , I like that .",2024-02
COMMENT_e8062d56,"@[USER]  Ripping children away from their parents, who clearly come from a culture that does things differently, without educating them or helping them assimilate is just as bad in its own way; I'm not referring to your extreme example which rarely happens. Ensuring that parents who come from a culture that still spanks will be properly educated and helped instead of traumatizing them by taking their children away would be a good start.

Making sure immigrants have a chance at upward mobility in the society they just joined would be a good start. In Canada and the United States we have programs like minority hiring to ensure companies must hire a certain number of minorities to combat racist thinking. We have a Human Rights Commission when those programs fail. In Canada we offer free English and French classes to all immigrants. Canada and the U.S. are of course far from perfect, but there is a general understanding of what is necessary to make immigration work when you have so many different cultures and beliefs in one place.

Also Canada is a Mosaic, only one in the world, so it welcomes people bringing their beliefs with them and sharing it with the rest of us. As long as those beliefs don't infringe on the beliefs of others it is welcomed, for the most part. Most of those beliefs are quite benign and interesting, but you might know that if you weren't focused on only the ones that support your anti-immigration narrative.",Non-PRCT,True,0,True,4,"@[USER]  So it's not a problem unless it affects you personally, directly and immediately? Nice

It runs the same for everyone. Take the Afghan refugees who aided the British, currently at risk of being murdered by Taliban or similar in the UK. Or what about gay people fleeing Iran and SA where they are hung from the neck till dead in public squares and thrown off tall buildings.

Or is that insufficiently wide for you? These were all examples from people I know who are immigrants. They left their home countries for a reason, blindly allowing the worst parts of their home that they're trying to escape while thinking you're smugly inclusive because you allow any crime so long as the person is non-native. Ask immigrants who're affected by the sorts of things I'm describing, try telling my friend Armin from Iran that the religious persecution for being Bahai and homophobic persecution within the immigrant Iranian community is just his failure at understanding and compassion about these awful people to whom we provide shelter and support. Good one, nice.",2023-08
COMMENT_87c2cb9b,"It is not our fault that our government will not respond to the will of the people or the direction of common sense.  They only respond when the people in power take the heat and even that is doubtful.  It is a pleasure to watch them squirm though.  Very entertaining!  But sooner or later the consequences of this  will not just be child trafficking, human trafficking, Fentenal deaths by the 100,000's, impossible strains on communities to cope-- we can expect terrorist activity since I doubt they are coming here because they love America.  Thank you D's for all you've done to ruin and destroy. Did you really think your open handedness with other people's money wouldn't come back to bite you?  Well at least you folks are always good for a giggle",Non-PRCT,True,0,True,1,I’m from Texas. Glad to see that the rest of the country is getting to experience and understand what southern border states have been dealing with for decades. Maybe now the rest of the country will get on board with shutting down the borders.,2023-09
COMMENT_2005def3,"@[USER]  origin is middle east but its european religion which ofc shaped all of european history and culture and still does today. All those countries you named are secular countries where there is no state religion and for example in Bosnia or Albania Muslims make around 50% of the population, so its not even majority religion. I should add that the form of islam there is very very liberal as i have visited Albania and Bosnia. You rly wanna start a debate with history graduate lol claiming something that christianity is from middle east and there are muslim minority countries in the Europe. Also its Europe not Eu if you even know the difference 🤡🤡 whats even the purpose of your arguments, i see zero value in them.",Non-PRCT,True,0,True,6,"@[USER] ”not European religion”🤡 Christianity is from the Middle-East, and there are muslim countries in Eu like bosnia,albania,kosovo etc",2023-08
COMMENT_64de66a9,"@[USER]  Sweden, Belgium, and Germany all seen a rise in crime.  They should have encourage their own citizens to have children and give tax breaks to nuclear families.  Bringing in poor, uneducated people who don't speak the language and don't share common values does not help the citizens... they end up using more resources and do not replace what they use with what they contribute.  It is a net loss for the citizens.",Non-PRCT,True,0,True,2,"I can understand your take on this but I don't think less or more development is the problem. There are many developed nations which receive a fair amount of immigrant workforce and still do well. From those refugees/immigrants that Sweden shelters, the government can/should select who is capable to stay and who isn't after all it is a bilateral exchange (if you stay with us then work and contribute). Now, I think we can agree in the fact that having foreigners who come from a less radical culture and share many common values does help to keep a balance after all the natives and foreigns need to coexist peacefuly. 

Politicians are the ones to blame on this one for trying to look selfless and pure of heart. But they don't want to engage on doing the proper work to keep the country safe. The immigrants have to work harder to reach the level of the locals otherwise will be always marginalized.

 I have lived abroad myself and it is not that dificult to respect the culture and society I was living in. In fact, it is the smartest way to stay away from trouble if you just don't stand out at all. It makes the local more receptive, it makes you more approachable and locals are less likely to brand you with negative steriotypes because there is none. 


Anyways, I hope your leaders have the courage to do the right thing and be more ristrictive to keep the standards and safety of all.",2023-03
COMMENT_23fcf3bd,"@[USER]-kp3ld first of all the most people who you call Americans are also coming from Europe and Africa ore thit you forget that Spain and Portugal also colonized and who land it was before doesn't matter, it matters from who the country is now and the are entering illegal  and with violence",Non-PRCT,True,0,True,1,This is called an invasion,2024-07
COMMENT_2f42a856,The sickness of ideology agenda based thoughts taking precedent over logical thinking based on what is and will take place and the resulting probable outcome.,Non-PRCT,True,0,True,1,"I'm from Sweden and what really grinds my gears is that immigrants that have stable jobs or are self-employed pay taxes to this country, they and their children get integrated into this country, learn the language and they prosper but our government sends these immigrants back to their countries because they didn't get accepted for citizenship. At the same time, we have immigrants that are a part of organized crime and get their Swedish citizenship... Honestly, I have lost fate in the social democratic party and I think we would need a change in leadership...",2022-06
COMMENT_de27a4d5,"@[USER]  I know that, and I'm not condoning them coming in Illegally.
The point I'm trying to make is, if a person can come into our country without even speaking the language or even existing on united states records. And get a job and build themselves up to make a decent life for themselves. Why can't American Citizens do the same? The reason they come here is to take up the slack from Americans who would rather do nothing and blame whoever is in charge for their misfortune. I hear you.. come in legally do it the right way. In my line of work, I deal with a lot of immigrants who came in to this country illegally. Want to know a little secret.. the majority of them don't speak Spanish. Life is like a race..and instead of screaming at me to do things the right way, you should be screaming at the younger generation to run faster than the ""illegal immigrants"" aka Mexicans. Instead of teaching them how to blame everything on whoever is in the White.",Non-PRCT,True,2,True,3,"@[USER] 
We have laws governing the border , but the one in the White is not allowing the law to be upheld .
People can come her but there is a right way and a wrong/illegal way. Do it the right way !!!",2023-09
COMMENT_674566b1,"oskrrr92 There's a massive difference between a fair fight and what the Europeans handed the Native Americans back in the day. It was a massacre. As such, it's rather a jerk move for you to laugh about it.",Non-PRCT,True,3,True,1,The TRUTH hurts!!,2018-04
COMMENT_fd69ae22,"@[USER]   oh so you know me?  I'm of Irish decent & yep my great gran got welfare.
If you think I'm insulted guess again.
If is free it's for me. I'm going downtown  sign up for free room& board w cell phone incl.
Thanks Longhorn.
👋 ✌🏼👍",Non-PRCT,True,1,True,2,That is something to be proud of someone else paying your way.,2023-01
COMMENT_1a349455,"@[USER]  ""jajajaja"" we made this country its ours! Spanish is a European language learn your native Language why don't you! still speaking the languge of the European Spanish colonies!",Non-PRCT,True,0,True,3,​@[USER] jajaja yep,2023-08
COMMENT_fbf475e7,"Gotta puy some effort into looking up the real problem, Americans fund the cartel whether it’s though buying their drugs or just partying in Mexico, cartels have their hands in everything including their government, these innocent people will mostly just add to the work force in the U.S which is a good thing considering more and more Americans are becoming lazy entitled and drug addicts that are encouraged to get government assistance and still whine about how America is shit, as for the bad apples in Mexico, focus on them, because even tho it’s not “Americas problem” America is sure not helping by funding the illegal side of things involving the criminals of Mexico",Non-PRCT,True,1,True,1,They have to use this energy against their government and make their lives better in their own country,2023-12
COMMENT_bd493fed,@[USER] their children will be born citizens and will be able to vote..politicians are playing chess while you’re playing checkers,Non-PRCT,True,1,True,5,"@[USER]  you need to be a registered voter to vote. Even if people are illegally voting like that, the amount is so little.

 Sad what current conservative ""leaders"" have done to there followers. Completely out of touch with reality.",2023-10
COMMENT_0f1008f1,"@[USER]  It can be.  Depends on how many of the asylum seekers are 5th column.  For the most part, it's highly understandable that they're giving large numbers of them asylum.

These are ""friendly native Chinese"" according to logic.  As the PRC continues it's decline, you actually DO want to take in those willing to live in the USA(which is demonized just like in all the other official pariah states.  Russia, China, N. Korea, Iran)

Remember one fact.  China has a declining demographic(which is a facet of industrialization).  They are NOT willing to be bleeding citizens through emigration.  The USA CAN feed them, the USA can support them in the job market.  The USA has a functioning economy.",Non-PRCT,True,3,True,3,@[USER] oooooo soo scary the Chinese 😒,2024-02
COMMENT_1b517dd1,all Lives are matter and every Circumstances are different.  I don't have to agree with certain things or how they're got here. But i definitely have COMPASSION for those are dying and in need help....I'm sure all YA'LL Ancestors came from somewhere and didn't speak English...the only true American is Native American founded this effing Land first...WTF 🤬🫵🫵🔥🏕🌋🏞🛖,Non-PRCT,True,0,True,1,"It took me years, lots of paperwork, medical tests, background checks, most of my lifes savings and many visits to the INS offices before being granted the privilege of taking an oath of allegiance and becoming a US Citizen.  Honor, integrity and the utmost respect for the rules and laws should be required by anyone who desires to be part of our nation.",2023-08
COMMENT_d082e31d,"@[USER]  I am not saying this isn't true - I don't know.  But I do wonder the source of these reports.  Who is surviving to get the story out?  and how?   We also know women travel here specifically to give birth on American soil and have instantaneous citizenship for their baby and a hook into getting to stay themselves.  I'm not saying all immigrant or migrant women do this but how can anyone know?    Tolerating and helping and compassion are not working.  It's great for people coming from a situation so bad that almost anything they encounter here is better - but there are small towns and ranches on the Southern border being destroyed in their way of life, livelihood, community safety and security, the peace of mind destroyed by the stress of strangers sneaking through at all hours ... at best  that's when they just keep going.  Cartels operating in our  public and private forests organized crime spreading into California from south of the border. Fentanyl getting as far north as Washington and Colorado. Local areas pushing to allow undocumented aliens to vote in local elections.  Places like New York and Chicago complaining that they're being devistated by numbers of illegal aliens in a month that are a fraction of what Texas residents are seeing in a week.  Check the raw numbers there are approximately 6 times the illegal aliens in the US than all people in any kind of incarceration in the US - that included Indian Reservations jails, other local jails, insane asylums, juvenile  hall, state, federal, local prisons.  All of it - and I got the number from the .gov.   If our ""mass incarceration"" rate is too high how is it that 6 times that number of illegal aliens isn't a problem?     This administration is lying to us on a daily basis.  The question is why.  What do they get out of this?  When?  Who?",Non-PRCT,True,0,True,2,"well maybe it could be families that are in immediate, grave danger. Latin America has the worst femicide rates in the world which means children are in danger too. I've heard of mothers trying to escape murderous ex-husbands just to save their children's lives, only to be rejected and sent back to their deaths when they fail to get past the border. it's not America's problem but then again are we able to turn our backs on mothers and children?",2023-10
COMMENT_a5c9feb4,These people are going to be more loyal to the US than the majority of people born there@[USER],Non-PRCT,True,0,True,2,Yes I believe most of these people have good intentions but there will always be the few that have bad intentions coming into the US. We must still know who is coming in to our country. it is our right.,2024-02
COMMENT_72f7f3cb,"Never vote for top-down control, central planning. Socialism was NEVER about the workers, classes, races, genders or the environment. It's all about surrendering power and control. Divide and conquer.",Non-PRCT,True,0,True,1,"As a Swede I can recommend you to not vote socialistic when they have gone past their true goal of worker rights and economic and social equality and exchanged it for ""world saving"" grandios delusions.",2023-03
COMMENT_20bc1b13,@[USER]-cw1hj  yes but they aren't citizens. No way to get social security card. It is a total mess. CA has so ma y homeless already. It's going to destroy our country,Non-PRCT,True,0,True,1,"Sadly, on every corner in my city is a homeless person and meanwhile if any or some of these people make it over here in this order they’ll live better than most Americans.",2023-05
COMMENT_2db5e510,"@[USER]  totally agree, if there was another planet to move to with less population and no crime I'd be the first in line. America is so unsafe, u never know who will shoot u while driving on any road, way to much violence, anger in to many people, children are no longer safe either. This planet needs a do over.",Non-PRCT,True,0,True,2,Why do you want to come here? America aint that great anymore. Im being serious.,2023-04
COMMENT_1d7861a7,I hope America gets flooded until it sinks 😂,Non-PRCT,True,0,True,1,"The crazy part is that it’s not just Mexicans. It’s Armenians, Russians, Asians, etc. as a Mexican it’s really not good to be letting all these people into the US that easy.",2023-04
COMMENT_2feff1c7,They need to send people in and drag them out and beat the shit of them because thats whats gonna happen if this doesnt stop people are gonna take the law into their own hands these shitstompers are already starting fights and other motels this is insanity,Non-PRCT,True,0,True,1,They refused to leave? Why arent they being thrown out. Who the F are they. This is insanity.,2023-08
COMMENT_4c7636d0,really? with all that stolen land? must be the most ignorant nation on earth!  stop arming criminals and calling their victims an invasion. its called karma,Non-PRCT,True,0,True,1,Sad reality is that Americans can barely find housing themselves….,2023-03
COMMENT_ea5ed5bf,"I look upon Poland and other countries like Hungary and marvel at how easy it was not to destroy our own country.
Hopefully in time the tide can be turned, and the infested swamp that is our politics can be drained.",Non-PRCT,True,10,True,1,"I’m Polish. Out government isn’t great but I’m so greatful that said no to imigrants from middle east or africa. I know many great people from Ukraine living in Poland. All my Ukrainian friends can speak perfectly Polish, have a legal job, etc.",2023-09
COMMENT_919aeb74,Sweden  would be majority islamic after 2060 😢😢😢,Non-PRCT,False,2,True,0,,2023-10
COMMENT_8f247de5,"+Erandiski 1492 Lies? Those are actually facts your ancestors immigrated from Asia
So there are no ""natives"" Americans",Non-PRCT,True,3,True,1,"The Real All American look. Brown skin,Brown eyes Dark  hair.",2018-03
COMMENT_277c86c5,O sorry  I didn't mean to send that one to you and that means I most have sent the complement I sent to the trumper. But it's not nice to make fun of people with reading problems.,Non-PRCT,True,0,True,1,Remember when Trump was evil for trying to stop this,2023-03
COMMENT_701dcf89,"And the poor people that are trying to come in, according to our laws will never get in because we are overrun with illegal immigrants. Our own homeless, veterans, mentally ill, are living on the streets while these people are put up in $300 a night hotels. The only way to change this is to vote the right way in 2024.",Non-PRCT,True,0,True,1,I feel sorry for them I really do but you got to come in this country the right way.,2023-04
COMMENT_e5c1d5b6,@[USER]  then fight your own Government,Non-PRCT,True,0,True,3,"@[USER]  
Remember the FACTS brother. Their government are too shady and folks there have mainly given up on their government therefore they're coming here!
We pay our taxes BUT they making under the table making money through tax evasion, and mainly through identity theft.",2019-03
COMMENT_8ffb0764,Im native from washington state my name is jayce i speak klallam my native name is teilani I was born in the 2000 and great great granddaughter of the cheif white feather,Non-PRCT,True,2,True,1,Hi I’m native and from Canada. My name is Levi my native name neebi I speak ooji-cree it’s a language from way back. I was born on 2000. If you wanna know more about native people or ooji-cree just comment,2019-03
COMMENT_8e62226e,"@[USER]   Shut up. Don't just brush off rise in reyp, sekshual har ras meant, as salt and moor-dhur in Sweden just to cover up for your beloved abduls. Yes, the problem is the im me grants themselves. Dont fool yourself. The integration will depend on the im mee grants themselve. These people are religious people who believe in a backward barbaric religion. For them, these are their values so the integration fails. Don't cover for them. Why is it that any nationality can integrate to Sweden culture but these abduls can't? Its the im mee grants who need to integrate, if they don't want to integrate, then they are problem. Why don't you have problems with other immigrants? Why only islamic immigrants? Don't delude yourself, these people are ultra sensitive whenever they perceive their religion is criticize and they will riot and lash out. They are professional victims who use violence and social pressure to get what they want with the help of stupid and naive Left as well as their rich brothers in faith in the ME. People like you love to fool yourself by outright truth even if you can see it clearly because of your ideology. I bet if these were done by christians you will be the first to blame and mock them. The reality is, you can't integrate people with diametrically opposing values and thinking and beliefs. Its like putting antifa and ultra leftists with trump supporters or israelis and palestinians and pretend there wont be problems. Stop pretending like these eem mee grants are innocents and angels. The rise in anti semitism is rooted on the rise of abdul immigrants. You're very naive about their religion and their Quran. Once they are the majority, see what happens. It will be like India-Pakistan and Lebanon.",Non-PRCT,False,0,True,2,"This implies that rape and murder is a cultural norm for Syrians and Iraqi’s.
The Swedes do have a problem, but the real problem is the lack of decent integration efforts and background checks, aka the ‘open door policies’ and not with migrants cultural backgrounds.",2022-08
COMMENT_9e991cbb,"Trudeau has wrecked our once great nation. He destroyed the economy, more than doubled the national debt and created a tiered class system while overwhelming all of our infrastructure with his feel-good idiotic tweets about Canada welcoming everyone.",Non-PRCT,True,0,True,1,"Exactly what I expected.

Trudeau is SO preachy to the US & Trump, but is stricter about ""immigrants"".

""Do as I say, not as I do,""",2024-10
COMMENT_9b00edc1,"so bring forth the proof that native americans have a dna sequence with any similarity to that of the chinese, japanese or even iranian people. Because these people ARE the descendants of japeth that dwelt in the area of asia that you are referring to. There are NO records of native americans ever being in siberia and all this other foolishness you talking. AT ALL",Non-PRCT,True,0,True,1,"If you take his point literally, the ""native American"" is also an immigrant. His ancestors came from Asia. They were not native to America.",2013-12
